{
  "schema_version": 1,
  "run_id": "multi_turn_2__default__qwen38-27b__20261007T134149",
  "suite": "multi_turn_2",
  "profile": "default",
  "model": "qwen38-27b",
  "endpoint": "http://192.168.50.153:8080/v1",
  "params": {
    "thinking": false,
    "temperature": 0.0,
    "multi_turn": true,
    "preserve_thinking": false,
    "max_tokens": null
  },
  "started_at": "2026-10-07T13:41:49+00:00",
  "finished_at": "2026-10-07T13:42:36+00:00",
  "context_window": 65536,
  "context_source": "models.meta.n_ctx",
  "jobs": [
    {
      "job_id": "multi_turn_2",
      "params": {
        "thinking": false,
        "temperature": 0.0,
        "multi_turn": true,
        "preserve_thinking": false,
        "max_tokens": 1024
      },
      "sub_jobs": [
        {
          "label": "part 1",
          "prompt_bytes": 65609,
          "prompt_tokens": 25702,
          "prompt_tokens_estimated": false,
          "ttft_seconds": 18.759611161000066,
          "generation_seconds": 0.0,
          "stream_seconds": 18.821698716001265,
          "output_tokens": 2,
          "chunk_count": 1,
          "cached_tokens": 0,
          "tokens_per_second": null,
          "prefill_tokens_per_second": 1370.0710414207667,
          "response": "OK",
          "reasoning": "",
          "status": "pass",
          "reason": null
        },
        {
          "label": "part 2",
          "prompt_bytes": 65612,
          "prompt_tokens": 51875,
          "prompt_tokens_estimated": false,
          "ttft_seconds": 27.362019815001986,
          "generation_seconds": 0.0,
          "stream_seconds": 27.42485284600116,
          "output_tokens": 2,
          "chunk_count": 1,
          "cached_tokens": 25705,
          "tokens_per_second": null,
          "prefill_tokens_per_second": 956.4352404149481,
          "response": "OK",
          "reasoning": "",
          "status": "pass",
          "reason": null
        },
        {
          "label": "part 3",
          "prompt_bytes": 65635,
          "prompt_tokens": 73680,
          "prompt_tokens_estimated": false,
          "ttft_seconds": null,
          "generation_seconds": null,
          "stream_seconds": null,
          "output_tokens": null,
          "chunk_count": 0,
          "cached_tokens": null,
          "tokens_per_second": null,
          "prefill_tokens_per_second": null,
          "response": "",
          "reasoning": "",
          "status": "skipped",
          "reason": "exceeds context: 73680 prompt + 1024 max_tokens > 65536"
        },
        {
          "label": "one more line",
          "prompt_bytes": 168,
          "prompt_tokens": null,
          "prompt_tokens_estimated": false,
          "ttft_seconds": null,
          "generation_seconds": null,
          "stream_seconds": null,
          "output_tokens": null,
          "chunk_count": 0,
          "cached_tokens": null,
          "tokens_per_second": null,
          "prefill_tokens_per_second": null,
          "response": "",
          "reasoning": "",
          "status": "skipped",
          "reason": "previous turn exceeded context"
        }
      ]
    }
  ],
  "summary": {
    "jobs": 1,
    "sub_jobs": 4,
    "passed": 2,
    "failed": 0,
    "errors": 0,
    "skipped": 2,
    "pass_rate": 1.0,
    "median_ttft_seconds": 23.060815488001026,
    "median_tokens_per_second": null,
    "median_cached_tokens": 12852.5
  }
}
